{
	"id": "neosantara-ai-gateway-bonus-rp-20000-kredit-rp-10000-bulan",
	"title": "Neosantara AI Gateway: Bonus Rp 20.000 + Kredit Rp 10.000/Bulan",
	"provider": "Neosantara",
	"description": "Gateway API AI terpadu untuk developer Indonesia yang menyatukan 40+ model AI terbaik dunia (seperti Claude, Gemini, GPT, hingga Llama) dalam satu endpoint kompatibel SDK OpenAI & Anthropic.",
	"benefits": [
		"Welcome bonus Rp 20.000 gratis saat pendaftaran",
		"Reset kredit gratis Rp 10.000 setiap bulan"
	],
	"requirements": [
		"Daftar akun di Neosantara",
		"Buat API Key pertama Anda di dashboard untuk mulai menggunakan di https://app.neosantara.xyz/api-keys"
	],
	"validity": {
		"type": "uncertain"
	},
	"ctaLink": "https://app.neosantara.xyz/signup",
	"tags": [
		"AI",
		"AI Credits",
		"AI Tools",
		"API",
		"No Credit Card",
		"Free Tier",
		"Gratisan",
		"Developer Tools"
	],
	"status": "active",
	"featured": false,
	"publishedAt": "2026-06-22",
	"contributorSlug": "errickow"
}
