{
    "id": "aiclass-asean-courses",
    "title": "Course Gratis AI dari AI Class ASEAN",
    "provider": "AI Class ASEAN",
    "description": "Program kursus gratis kolaborasi AI Class ASEAN sama ASEAN Foundation, didukung Google.org, yang bisa kamu ikuti sambil dapet sertifikat resmi setelah lulus dan submit tugas dengan rapi.",
    "benefits": [
        "Kursus gratis lewat program kolaborasi regional",
        "Sertifikat selesai kursus untuk penguatan portfolio",
        "Didukung ASEAN Foundation dan Google.org",
        "Bisa jadi jalan tercepat buat ngembaliin skill AI ke tingkat yang lebih oke"
    ],
    "requirements": [
        "Pakai link referal/undangan dari guru atau mentor yang sudah handle akuisisi peserta",
        "Selesaikan semua misi dan tugas yang disyaratkan untuk dapat reward",
        "Kumpulkan bukti progres untuk klaim reward jika disediakan di program",
        "Bawa tautan referal guru saat daftar jika diminta sistem",
        "Bisa dapat bonus pulsa 50.000 setelah menyelesaikan semua misi (informasi dari peserta)"
    ],
    "validity": {
        "type": "uncertain",
        "description": "Cek halaman kursus untuk periode dan persyaratan terbaru"
    },
    "ctaLink": "https://www.aiclassasean.org/courses?utm_source=bansos.dev&utm_medium=referral&utm_campaign=bansos",
    "tags": [
        "Course",
        "Diskon"
    ],
    "status": "active",
    "featured": false,
    "publishedAt": "2026-06-13",
    "contributorSlug": "wildan"
}