{
	"id": "helipod-domain-id-rp45k-hosting-merdeka-2026",
	"title": "Promo Domain .ID Rp45.000 & Hosting Helipod — 17 Agustus 2026",
	"provider": "Helipod",
	"providerWebsiteUrl": "https://helipod.io",
	"description": "Helipod menghadirkan promo satu hari pada 17 Agustus 2026 untuk domain .ID, domain .MY.ID/.BIZ.ID/.WEB.ID, serta paket resource bulanan.",
	"benefits": [
		"Domain .ID seharga Rp45.000",
		"Domain .MY.ID, .BIZ.ID, dan .WEB.ID seharga Rp81",
		"Paket resource bulanan Nano, Micro, dan Starter diskon 50%",
		"Periode promo 17 Agustus 2026 pukul 07.00–23.59 WIB"
	],
	"validity": {
		"type": "fixed",
		"date": "2026-08-17",
		"description": "Promo berlaku satu hari pada 17 Agustus 2026 pukul 07.00–23.59 WIB."
	},
	"requirements": [
		"Klaim selama periode promo berlangsung",
		"Harga domain belum termasuk PPN 11%",
		"Perhatikan ketersediaan kuota dan harga final sebelum pembayaran"
	],
	"ctaLink": "https://helipod.io/",
	"tags": ["Domain", "domain17", "Hosting", "Cloud"],
	"status": "active",
	"featured": false,
	"publishedAt": "2026-08-17",
	"tips": "Detail harga promo bersumber dari materi promo Helipod yang diterima kontributor. Promo hanya berlaku 17 Agustus 2026, harga domain belum termasuk PPN 11%, dan kuota terbatas; cek halaman resmi atau checkout untuk ketentuan final.",
	"source": "https://helipod.io/",
	"contributorSlug": "wauputr4"
}
