{
	"id": "tencent-cloud-free-tier",
	"title": "Tencent Cloud Free Tier (Trial Gratis 30+ Produk)",
	"provider": "Tencent Cloud",
	"description": "Tencent Cloud menyediakan free trial untuk lebih dari 30 produk cloud, termasuk komputasi, storage, jaringan, komunikasi real-time, dan layanan AI.",
	"benefits": [
		"Lighthouse 2C2G gratis selama 3 bulan",
		"Cloud Virtual Machine 2C4G gratis selama 3 bulan",
		"Cloud Object Storage 50GB gratis selama 6 bulan",
		"TRTC 10.000 menit gratis setiap bulan",
		"EdgeOne gratis selama 14 hari",
		"Tencent Hunyuan 3D 200 kredit gratis selama 1 tahun"
	],
	"validity": {
		"type": "uncertain",
		"description": "Durasi dan kuota berbeda untuk setiap produk. Trial hanya tersedia bagi pengguna baru produk terkait dan mengikuti aturan resmi Tencent Cloud."
	},
	"requirements": [
		"Buat atau masuk ke akun Tencent Cloud",
		"Selesaikan verifikasi akun",
		"Belum pernah menggunakan atau mencoba produk Tencent Cloud terkait",
		"Periksa konfigurasi trial dan aturan produk sebelum mengaktifkan"
	],
	"publishedAt": "2026-07-22",
	"source": "https://www.tencentcloud.com/act/pro/FreeTier",
	"ctaLink": "https://www.tencentcloud.com/act/pro/FreeTier",
	"tags": ["Cloud Services", "Free Tier", "VPS & Server", "Hosting"],
	"featured": false,
	"status": "active",
	"contributorSlug": "superftch"
}
