{
	"id": "huige-relay-free-100-api-calls",
	"title": "Huige Relay Free 100 API Calls + 50 Bonus Referral",
	"provider": "Huige Relay (辉哥中转公益站)",
	"description": "Huige Relay adalah relay AI gratis kompatibel OpenAI yang menyatukan 19 model aktif di satu endpoint. Kuotanya dihitung per panggilan, bukan per token: setiap akun baru langsung menerima 100 panggilan beserta API key otomatis, pendaftar yang memakai kode undangan mendapat 50 panggilan tambahan, dan check-in harian mengundi 50 sampai 100 panggilan lagi. Tarif standar satu kuota per permintaan sehingga sebagian besar model bisa dipakai puluhan kali. Sebaliknya claude-opus-5 dipatok 500 kuota per permintaan dan deskripsi resminya menyebut model itu sementara tidak dapat dipakai, jadi kredit gratis di sini praktis tidak cukup untuk Claude; nilai sebenarnya ada di DeepSeek V4, Kimi K3, GLM 5.2, Gemini 2.5 Flash, Qwen 3.7, dan MiniMax.",
	"benefits": [
		"100 panggilan API otomatis untuk setiap akun baru, tanpa kartu kredit",
		"Tambahan 50 panggilan khusus pendaftar yang memakai kode undangan, dicairkan setelah panggilan sukses pertama, sementara pengundang menerima 100",
		"Check-in harian mengundi 50 sampai 100 panggilan tambahan setiap hari",
		"19 model aktif lewat satu endpoint kompatibel OpenAI, termasuk DeepSeek V4 Pro dan Flash, Kimi K3, GLM 5.2, Gemini 2.5 Flash, Qwen 3.7 Max, MiniMax M3, Step 3.7 Flash, MiMo V2.5 Pro, dan gpt-oss 120b",
		"Penagihan per panggilan dan bukan per token, sehingga panggilan yang gagal tidak memotong kuota",
		"Saldo hasil check-in bisa ditukar menjadi paket langganan di dompet akun, misalnya paket tiga hari berisi 100 panggilan yang direset setiap enam jam"
	],
	"validity": {
		"type": "uncertain",
		"description": "Situs menyatakan dirinya proyek gratis permanen dan tidak menarik biaya apa pun, tetapi tidak menyediakan syarat layanan maupun kebijakan privasi, dan tarif tiap model bisa diubah admin sewaktu-waktu seperti yang terjadi pada 11 Agustus 2026"
	},
	"requirements": [
		"Daftar dengan username, kata sandi, dan email yang diverifikasi lewat kode OTP serta captcha",
		"Isi kolom kode undangan opsional saat mendaftar supaya bonus 50 panggilan ikut masuk",
		"Buat API key berawalan sk-gw- di dashboard lalu arahkan klien ke https://lzhiyu.ccwu.cc/ memakai format OpenAI v1/chat/completions",
		"Lakukan check-in harian di dashboard kalau ingin kuota terus bertambah"
	],
	"ctaLink": "https://lzhiyu.ccwu.cc/register?ref=REF-5E3E585BC4",
	"tags": ["AI Credits", "API", "Free Tier", "AI Tools", "Developer Tools"],
	"status": "active",
	"featured": false,
	"publishedAt": "2026-08-19",
	"tips": "Kredit gratis di sini tidak cukup untuk Claude: claude-opus-5 dipatok 500 kuota per permintaan dan ditandai sementara tidak dapat dipakai, sementara saldo awal lewat kode undangan hanya 150, sedangkan model lain berkisar 1 kuota untuk model tanpa harga khusus sampai 5 kuota untuk Kimi K3. Karena penagihannya per panggilan, agen pengoding berbasis CLI menghabiskan kuota sangat cepat dan situsnya sendiri masih menandai endpoint format Anthropic serta klien PC dan CLI sebagai uji coba. Tidak ada syarat layanan maupun kebijakan privasi dan dukungan hanya lewat QQ, jadi jangan kirim data sensitif.",
	"source": "https://lzhiyu.ccwu.cc/",
	"contributorSlug": "syafii-fahreza"
}
