{
    "id": "aerolink-free-credits",
    "title": "Aerolink $350+ Free Credits",
    "provider": "Aerolink",
    "description": "Aerolink adalah unified API gateway untuk AI agent. Akun baru diklaim mendapat $350+ free credits/starter allowance untuk mencoba akses model route lewat satu API key.",
    "benefits": [
        "$350+ free credits untuk akun baru",
        "Satu API key untuk AI agent dan coding assistant",
        "Dashboard untuk usage logs, token, latency, cost, balance, dan limits",
        "Mendukung 6 model routes: claude-opus-4-8, claude-opus-4-7, claude-fable-5, claude-sonnet-4-6, claude-opus-4-6, claude-haiku-4-5-20251001",
        "Rolling usage window 5 jam dan mingguan"
    ],
    "requirements": [
        "Buat akun Aerolink",
        "Verifikasi email",
        "Generate API key dari dashboard",
        "Cek credit, model route, dan limit di dashboard sebelum digunakan"
    ],
    "validity": {
        "type": "uncertain",
        "description": "Belum ada tanggal berakhir, namun untuk promo 80$ hanya berlaku sampai tanggal 18 Juni; berlaku selama promo $350+ free credits masih tampil di situs Aerolink"
    },
    "ctaLink": "https://aerolink.lat/",
    "tags": [
        "AI Tools",
        "API",
        "Cloud Services"
    ],
    "status": "expired",
    "featured": false,
    "publishedAt": "2026-06-15",
    "contributorSlug": "aofsnorth"
}