{
	"id": "mimo-plan-free-nanaai",
	"title": "Free Mimo Plan di NanaAI",
	"provider": "NanaAI",
	"description": "⚠️ Ada laporan free plan sudah tidak bisa diklaim. NanaAI adalah platform API key AI yang menyediakan free plan Mimo v2.5 dan Mimo v2.5 Pro. Cukup top up minimal $1 sebagai verifikasi user untuk hindari abuse, free plan langsung aktif selama 30 hari dengan limit harian 3M. Jangan abuse — akun akan dibanned jika ketahuan abuse!",
	"benefits": [
		"Free akses Mimo v2.5 dan Mimo v2.5 Pro",
		"Model gratis: mimo-v2.5-pro & mimo-v2.5",
		"Free saldo dan plan untuk referral program",
		"Limit harian 3M selama 30 hari",
		"Hasil referral dibagikan gratis di Discord bansos.dev"
	],
	"requirements": [
		"Daftar akun di NanaAI",
		"Top up minimal $1 sebagai verifikasi user (anti-abuse)",
		"Jangan abuse — akun akan dibanned jika ketahuan menyalahgunakan"
	],
	"validity": {
		"type": "uncertain",
		"description": "Free plan aktif selama 30 hari setelah top up, ada kemungkinan diperpanjang otomatis tanpa perlu top up ulang"
	},
	"ctaLink": "https://nana.mwcs.dev/signup?ref=5JT7QA",
	"tags": ["AI tools", "Dev Tools", "AI Provider"],
	"status": "active",
	"featured": false,
	"tips": "⚠️ LAPORAN: Free plan dilaporkan sudah tidak bisa diklaim. Top up $1 minimal untuk aktivasi, free plan langsung aktif. Hasil referral dibagikan gratis di Discord bansos.dev — gabung dan cek #berbagi-api. Manfaatkan program referral untuk saldo tambahan dan perpanjangan plan. JANGAN abuse — akun akan dibanned!",
	"publishedAt": "2026-07-06",
	"source": "https://nana.mwcs.dev",
	"providerWebsiteUrl": "https://nana.mwcs.dev",
	"contributorSlug": "mugi-wiguna"
}
