{
	"id": "modelset-free-credit",
	"title": "ModelSet Free $1 AI API Credit",
	"provider": "ModelSet",
	"description": "AI API gateway dengan format OpenAI, Claude, dan Gemini-compatible. Pengguna baru mendapat kredit awal $1 untuk mencoba berbagai model Claude tanpa subscription.",
	"benefits": [
		"Kredit awal $1 untuk pengguna baru",
		"Tidak memerlukan subscription",
		"Akses berbagai model Claude melalui satu API",
		"Mendukung endpoint OpenAI dan Anthropic-compatible"
	],
	"validity": {
		"type": "uncertain",
		"description": "Berlaku selama program kredit pengguna baru masih tersedia"
	},
	"requirements": [
		"Daftar akun baru menggunakan GitHub",
		"Login ke dashboard",
		"Buat API key dan gunakan layanan tanpa pendaftaran akun ganda"
	],
	"ctaLink": "https://modelset.top/register?aff=JGAt",
	"tags": ["AI API", "Claude", "LLM", "Free Tier"],
	"status": "active",
	"featured": false,
	"publishedAt": "2026-07-23",
	"tips": "Gunakan kredit seperlunya. ModelSet dapat menutup akun yang terindikasi melakukan pendaftaran berulang atau penyalahgunaan.",
	"source": "https://modelset.top/",
	"contributorSlug": "syafii-fahreza"
}
