{
	"id": "biznetgio-domain-id-rp8100-17-agustus-2026",
	"title": "Domain .ID Rp8.100 Biznet GIO — Festival Domain Merdeka 2026",
	"provider": "Biznet GIO",
	"description": "Biznet GIO menawarkan promo registrasi domain .ID seharga Rp8.100 per tahun untuk 170 pembeli tercepat pada 17 Agustus 2026, dengan opsi alternatif domain .ID Rp50.000 plus cashback Rp5.000.",
	"benefits": [
		"Registrasi domain .ID seharga Rp8.100 per tahun untuk 170 pembeli tercepat",
		"Kode promo IDMURAH8100",
		"Alternatif domain .ID Rp50.000 plus cashback Rp5.000 dengan kode MERDEKAID45 dan kuota 810 pembeli"
	],
	"validity": {
		"type": "fixed",
		"date": "2026-08-17",
		"description": "Promo utama dan alternatif berlaku pada 17 Agustus 2026 selama kuota masing-masing masih tersedia."
	},
	"requirements": [
		"Daftarkan domain .ID baru melalui portal Biznet GIO",
		"Gunakan kode IDMURAH8100 saat checkout untuk promo Rp8.100",
		"Jika promo utama habis, gunakan kode MERDEKAID45 untuk promo Rp50.000 plus cashback Rp5.000",
		"Isi formulir klaim cashback setelah transaksi jika memakai promo alternatif"
	],
	"ctaLink": "https://portal.biznetgio.com/",
	"providerWebsiteUrl": "https://www.biznetgio.com",
	"tags": ["Domain", "domain17", "Diskon"],
	"status": "active",
	"featured": false,
	"publishedAt": "2026-08-17",
	"promoCode": "IDMURAH8100",
	"tips": "Detail promo berasal dari email resmi Biznet GIO: promo utama dibatasi 170 pembeli tercepat, sedangkan promo alternatif memiliki kuota 810 pembeli dan cashback harus diklaim melalui formulir setelah transaksi. Tautan klaim memakai portal resmi Biznet GIO, bukan URL tracking email; verifikasi kuota, kode, dan syarat cashback sebelum membayar.",
	"source": "https://www.biznetgio.com/promo",
	"contributorSlug": "wauputr4"
}
