{
	"id": "tokenfaucet-daily-free-tokens",
	"title": "TokenFaucet Daily Free LLM API Tokens",
	"provider": "TokenFaucet",
	"description": "AI API gateway dengan token gratis harian, endpoint kompatibel OpenAI dan Anthropic, serta pilihan model gratis maupun berbayar.",
	"benefits": [
		"Klaim gratis 500.000 hingga 1.500.000 token per hari",
		"Bonus referral 1.024.000 token per pengguna yang mendaftar",
		"Endpoint kompatibel OpenAI dan Anthropic",
		"Tersedia beberapa model gratis dan berbayar"
	],
	"validity": {
		"type": "uncertain",
		"description": "Selama pool dan program token gratis harian tersedia"
	},
	"requirements": [
		"Daftar atau login akun TokenFaucet",
		"Klaim token dari pool harian",
		"Buat API key dan gunakan endpoint sesuai dokumentasi"
	],
	"ctaLink": "https://freetokenfaucet.com/?ref=27BX468Y",
	"tags": ["AI API", "LLM", "Free Tier"],
	"status": "active",
	"featured": false,
	"publishedAt": "2026-07-16",
	"tips": "Prioritaskan model berlabel Free dan jangan membuat akun ganda untuk mengulang klaim.",
	"source": "https://freetokenfaucet.com/",
	"contributorSlug": "syafii-fahreza"
}
